{
  "run_id": "example-run",
  "status": "pass",
  "mode": "html",
  "target": {
    "type": "html",
    "source": "shape.html"
  },
  "captured_at": "2026-06-08T00:00:00+00:00",
  "upstream_source": {
    "repo": "gstack",
    "adapter": "lodestar-browser-qa",
    "paths": [
      "third_party/upstream/gstack/qa",
      "third_party/upstream/gstack/qa-only",
      "third_party/upstream/gstack/design-review",
      "third_party/upstream/compound-engineering-plugin/plugins/compound-engineering/skills/ce-test-browser"
    ]
  },
  "viewport": {
    "name": "desktop",
    "width": 1440,
    "height": 900
  },
  "page": {
    "title": "Lodestar Shape",
    "text_sample": "UX Preview Approved",
    "text_length": 19,
    "headings": ["UX Preview Approved"],
    "links": 0,
    "buttons": 0,
    "buttons_without_name": 0,
    "inputs": 0,
    "inputs_without_label": 0,
    "images": 0,
    "images_without_alt": 0,
    "aria_labels": 0,
    "html_lang": true
  },
  "checks": {
    "load": {
      "status": "pass",
      "summary": "Loaded HTML artifact.",
      "evidence": ["shape.html"]
    },
    "title": {
      "status": "pass",
      "summary": "Page title is present.",
      "evidence": ["Lodestar Shape"]
    },
    "expected_text": {
      "status": "pass",
      "summary": "Expected text assertions passed.",
      "evidence": ["UX Preview Approved"]
    },
    "console": {
      "status": "not_applicable",
      "summary": "Console error evidence was not provided.",
      "evidence": []
    },
    "accessibility_baseline": {
      "status": "pass",
      "summary": "Accessibility baseline passed.",
      "evidence": []
    },
    "responsive_baseline": {
      "status": "pass",
      "summary": "Viewport baseline is usable.",
      "evidence": ["desktop=1440x900"]
    },
    "screenshot": {
      "status": "not_applicable",
      "summary": "Screenshot evidence was not requested.",
      "evidence": []
    }
  },
  "findings": [],
  "metrics": {
    "total_findings": 0,
    "critical_findings": 0,
    "high_findings": 0,
    "medium_findings": 0,
    "low_findings": 0,
    "check_pass_count": 5,
    "check_fail_count": 0,
    "check_warning_count": 0,
    "check_not_applicable_count": 2
  },
  "artifacts": {
    "screenshot": "",
    "console_errors": ""
  }
}
